<?xml version="1.0" encoding="UTF-8"?>
<operator name="MobileCompany"
    xmlns:xsi="http://www.w3.org/2001/XMLSchema-instance"
    xsi:noNamespaceSchemaLocation="Tariff.xsd">
<tariff id="tar1">
    <tariffname>WGold</tariffname>
        <payroll>100</payroll>
        <callprices>
            <insidenetwork>0</insidenetwork>
            <outsidenetwork>15</outsidenetwork>
            <tofixedphones>6</tofixedphones>
        </callprices>
        <smsprice>2</smsprice>
        <parameters>
            <favouritenumbers>10</favouritenumbers>
            <tariffing>twelve_seconds</tariffing>
            <connectpayment>50</connectpayment>
        </parameters>
    </tariff>
<tariff id="tar2">
    <tariffname>Family</tariffname>
    <payroll>250</payroll>
    <callprices>
        <insidenetwork>0</insidenetwork>
        <outsidenetwork>20</outsidenetwork>
        <tofixedphones>6</tofixedphones>
     </callprices>
     <smsprice>2</smsprice>
     <parameters>
        <favouritenumbers>5</favouritenumbers>
        <tariffing>twelve_seconds</tariffing>
        <connectpayment>100</connectpayment>
     </parameters>
</tariff>
<tariff id="tar3">
        <tariffname>your_tr</tariffname>
        <payroll>150</payroll>
        <callprices>
            <insidenetwork>1</insidenetwork>
            <outsidenetwork>5</outsidenetwork>
            <tofixedphones>6</tofixedphones>
        </callprices>
        <smsprice>0</smsprice>
        <parameters>
            <favouritenumbers>2</favouritenumbers>
            <tariffing>each_minute</tariffing>
            <connectpayment>50</connectpayment>
        </parameters>
</tariff>
<tariff id="tar4">
    <tariffname>TTTen</tariffname>
        <payroll>200</payroll>
        <callprices>
        <insidenetwork>10</insidenetwork>
        <outsidenetwork>10</outsidenetwork>
        <tofixedphones>10</tofixedphones>
    </callprices>
    <smsprice>10</smsprice>
    <parameters>
        <favouritenumbers>8</favouritenumbers>
        <tariffing>twelve_seconds</tariffing>
        <connectpayment>40</connectpayment>
    </parameters>
</tariff>
<tariff id="tar5">
    <tariffname>Work</tariffname>
        <payroll>400</payroll>
        <callprices>
        <insidenetwork>0</insidenetwork>
        <outsidenetwork>10</outsidenetwork>
        <tofixedphones>8</tofixedphones>
    </callprices>
    <smsprice>0</smsprice>
    <parameters>
        <favouritenumbers>5</favouritenumbers>
        <tariffing>each_minute</tariffing>
        <connectpayment>100</connectpayment>
    </parameters>
</tariff>
</operator>